to,                     from,                       id
Deku Tree Boss,         Deku Tree Before Boss,      0x40f
Dodongo Cavern Boss,    Dodongo Cavern Pre Boss,    0x40b
Jabu-Jabu Boss,         Jabu-Jabu Main,             0x301
Forest Temple Boss,     Forest Temple Antichamber,  0x00c
Fire Temple Boss,       Fire Temple Entrance,       0x305
Water Temple Boss,      Water Temple Antichamber,   0x417
Spirit Temple Boss,     Spirit Temple Statue,       0x08d
Shadow Temple Boss,     Shadow Temple Boat,         0x413
