id,                                       type,             to,                                         from,                                         reverse
BOSS_DEKU_TREE,                           boss,             Deku Tree Boss,                             Deku Tree Before Boss,                        NONE
BOSS_DODONGO_CAVERN,                      boss,             Dodongo Cavern Boss,                        Dodongo Cavern Skull,                         NONE
BOSS_JABU_JABU,                           boss,             Jabu-Jabu Boss,                             Jabu-Jabu Pre-Boss,                           NONE
BOSS_TEMPLE_FOREST,                       boss,             Forest Temple Boss,                         Forest Temple Antichamber,                    NONE
BOSS_TEMPLE_FIRE,                         boss,             Fire Temple Boss,                           Fire Temple Pre-Boss,                         NONE
BOSS_TEMPLE_WATER,                        boss,             Water Temple Boss,                          Water Temple Antichamber,                     NONE
BOSS_TEMPLE_SPIRIT,                       boss,             Spirit Temple Boss,                         Spirit Temple Statue,                         NONE
BOSS_TEMPLE_SHADOW,                       boss,             Shadow Temple Boss,                         Shadow Temple Boat,                           NONE
DEKU_TREE,                                dungeon,          Deku Tree,                                  Kokiri Forest Near Deku Tree,                 KOKIRI_FOREST_FROM_DEKU_TREE
KOKIRI_FOREST_FROM_DEKU_TREE,             dungeon,          Kokiri Forest Near Deku Tree,               Deku Tree,                                    DEKU_TREE
DODONGO_CAVERN,                           dungeon,          Dodongo Cavern,                             Death Mountain,                               MOUNTAIN_TRAIL_FROM_DODONGO_CAVERN
MOUNTAIN_TRAIL_FROM_DODONGO_CAVERN,       dungeon,          Death Mountain,                             Dodongo Cavern,                               DODONGO_CAVERN
JABU_JABU,                                dungeon,          Jabu-Jabu,                                  Zora Fountain,                                ZORA_FOUNTAIN_FROM_JABU_JABU
ZORA_FOUNTAIN_FROM_JABU_JABU,             dungeon,          Zora Fountain,                              Jabu-Jabu,                                    JABU_JABU
TEMPLE_FOREST,                            dungeon,          Forest Temple,                              Sacred Meadow,                                SACRED_MEADOW_FROM_TEMPLE_FOREST
SACRED_MEADOW_FROM_TEMPLE_FOREST,         dungeon,          Sacred Meadow,                              Forest Temple,                                TEMPLE_FOREST
TEMPLE_FIRE,                              dungeon,          Fire Temple,                                Fire Temple Entry,                            DEATH_CRATER_FROM_TEMPLE_FIRE
DEATH_CRATER_FROM_TEMPLE_FIRE,            dungeon,          Fire Temple Entry,                          Fire Temple,                                  TEMPLE_FIRE
TEMPLE_WATER,                             dungeon,          Water Temple,                               Lake Hylia,                                   LAKE_HYLIA_FROM_TEMPLE_WATER
LAKE_HYLIA_FROM_TEMPLE_WATER,             dungeon,          Lake Hylia,                                 Water Temple,                                 TEMPLE_WATER
TEMPLE_SHADOW,                            dungeon,          Shadow Temple,                              Graveyard Upper,                              GRAVEYARD_FROM_TEMPLE_SHADOW
GRAVEYARD_FROM_TEMPLE_SHADOW,             dungeon,          Graveyard Upper,                            Shadow Temple,                                TEMPLE_SHADOW
TEMPLE_SPIRIT,                            dungeon,          Spirit Temple,                              Desert Colossus,                              DESERT_COLOSSUS_FROM_TEMPLE_SPIRIT
DESERT_COLOSSUS_FROM_TEMPLE_SPIRIT,       dungeon,          Desert Colossus Spirit Exit,                Spirit Temple,                                TEMPLE_SPIRIT
BOTTOM_OF_THE_WELL,                       dungeon,          Bottom of the Well,                         Kakariko,                                     KAKARIKO_FROM_BOTTOM_OF_THE_WELL
KAKARIKO_FROM_BOTTOM_OF_THE_WELL,         dungeon,          Kakariko,                                   Bottom of the Well,                           BOTTOM_OF_THE_WELL
ICE_CAVERN,                               dungeon,          Ice Cavern,                                 Zora Fountain Frozen,                         ZORA_FOUNTAIN_FROM_ICE_CAVERN
ZORA_FOUNTAIN_FROM_ICE_CAVERN,            dungeon,          Zora Fountain Frozen,                       Ice Cavern,                                   ICE_CAVERN
GERUDO_TRAINING_GROUNDS,                  dungeon,          Gerudo Training Grounds,                    Gerudo Fortress Exterior,                     GERUDO_FORTRESS_FROM_GERUDO_TRAINING
GERUDO_FORTRESS_FROM_GERUDO_TRAINING,     dungeon,          Gerudo Fortress Exterior,                   Gerudo Training Grounds,                      GERUDO_TRAINING_GROUNDS
GANON_CASTLE,                             dungeon,          Ganon Castle,                               Ganon Castle Exterior After Bridge,           GANON_CASTLE_EXTERIOR_FROM_CASTLE
GANON_CASTLE_EXTERIOR_FROM_CASTLE,        dungeon,          Ganon Castle Exterior After Bridge,         Ganon Castle,                                 GANON_CASTLE
GANON_TOWER,                              dungeon,          Ganon Castle Tower,                         Ganon Castle Stairs,                          GANON_CASTLE_FROM_TOWER
GANON_CASTLE_FROM_TOWER,                  dungeon,          Ganon Castle Stairs,                        Ganon Castle Tower,                           GANON_TOWER
LOST_WOODS_BRIDGE_FROM_FIELD,             region,           Lost Woods Bridge,                          Hyrule Field,                                 FIELD_FROM_LOST_WOODS_BRIDGE
ZORA_RIVER_FROM_FIELD,                    region,           Zora River Front,                           Hyrule Field,                                 FIELD_FROM_ZORA_RIVER
KAKARIKO_FROM_FIELD,                      region,           Kakariko,                                   Hyrule Field,                                 FIELD_FROM_KAKARIKO
LON_LON_RANCH_FROM_FIELD,                 region,           Lon Lon Ranch,                              Hyrule Field,                                 FIELD_FROM_LON_LON_RANCH
LAKE_HYLIA_FROM_FIELD,                    region,           Lake Hylia,                                 Hyrule Field,                                 FIELD_FROM_LAKE_HYLIA
GERUDO_FORTRESS_FROM_VALLEY,              region,           Gerudo Fortress Exterior,                   Gerudo Valley After Bridge,                   VALLEY_FROM_GERUDO_FORTRESS
FIELD_FROM_LOST_WOODS_BRIDGE,             overworld,        Hyrule Field,                               Lost Woods Bridge,                            LOST_WOODS_BRIDGE_FROM_FIELD
FIELD_FROM_ZORA_RIVER,                    overworld,        Hyrule Field,                               Zora River Front,                             ZORA_RIVER_FROM_FIELD
FIELD_FROM_KAKARIKO,                      overworld,        Hyrule Field,                               Kakariko,                                     KAKARIKO_FROM_FIELD
FIELD_FROM_LON_LON_RANCH,                 overworld,        Hyrule Field,                               Lon Lon Ranch,                                LON_LON_RANCH_FROM_FIELD
FIELD_FROM_LAKE_HYLIA,                    overworld,        Hyrule Field,                               Lake Hylia,                                   LAKE_HYLIA_FROM_FIELD
VALLEY_FROM_GERUDO_FORTRESS,              overworld,        Gerudo Valley After Bridge,                 Gerudo Fortress Exterior,                     GERUDO_FORTRESS_FROM_VALLEY
OOT_HOUSE_MIDO,                           indoors,          Mido's House,                               Kokiri Forest,                                OOT_KOKIRI_FOREST_FROM_MIDO
OOT_KOKIRI_FOREST_FROM_MIDO,              indoors,          Kokiri Forest,                              Mido's House,                                 OOT_HOUSE_MIDO
OOT_HOUSE_SARIA,                          indoors,          Saria's House,                              Kokiri Forest,                                OOT_KOKIRI_FOREST_FROM_SARIA
OOT_KOKIRI_FOREST_FROM_SARIA,             indoors,          Kokiri Forest,                              Saria's House,                                OOT_HOUSE_SARIA
OOT_HOUSE_TWINS,                          indoors,          House of Twins,                             Kokiri Forest,                                OOT_KOKIRI_FOREST_FROM_TWINS
OOT_KOKIRI_FOREST_FROM_TWINS,             indoors,          Kokiri Forest,                              House of Twins,                               OOT_HOUSE_TWINS
OOT_HOUSE_KNOW_IT_ALL,                    indoors,          Know It All House,                          Kokiri Forest,                                OOT_KOKIRI_FOREST_FROM_KNOW_IT_ALL
OOT_KOKIRI_FOREST_FROM_KNOW_IT_ALL,       indoors,          Kokiri Forest,                              Know It All House,                            OOT_HOUSE_KNOW_IT_ALL
OOT_KOKIRI_SHOP,                          indoors,          Kokiri Shop,                                Kokiri Forest,                                OOT_KOKIRI_FOREST_FROM_SHOP
OOT_KOKIRI_FOREST_FROM_SHOP,              indoors,          Kokiri Forest,                              Kokiri Shop,                                  OOT_KOKIRI_SHOP
OOT_HOUSE_POTS,                           indoors,          Market Pot House,                           Market Entryway,                              OOT_MARKET_ENTRANCE_FROM_POTS
OOT_MARKET_ENTRANCE_FROM_POTS,            indoors,          Market Entryway,                            Market Pot House,                             OOT_HOUSE_POTS
OOT_LABORATORY,                           indoors,          Laboratory,                                 Lake Hylia,                                   OOT_LAKE_HYLIA_FROM_LABORATORY
OOT_LAKE_HYLIA_FROM_LABORATORY,           indoors,          Lake Hylia,                                 Laboratory,                                   OOT_LABORATORY
OOT_FISHING_POND,                         indoors,          Fishing Pond,                               Lake Hylia,                                   OOT_LAKE_HYLIA_FROM_FISHING_POND
OOT_LAKE_HYLIA_FROM_FISHING_POND,         indoors,          Lake Hylia,                                 Fishing Pond,                                 OOT_FISHING_POND
OOT_VALLEY_TENT,                          indoors,          Gerudo Valley Tent,                         Gerudo Valley After Bridge,                   OOT_GERUDO_VALLEY_FROM_TENT
OOT_GERUDO_VALLEY_FROM_TENT,              indoors,          Gerudo Valley After Bridge,                 Gerudo Valley Tent,                           OOT_VALLEY_TENT
OOT_HOUSE_CARPENTER,                      indoors,          Kakariko Carpenter House,                   Kakariko,                                     OOT_KAKARIKO_FROM_CARPENTER
OOT_KAKARIKO_FROM_CARPENTER,              indoors,          Kakariko,                                   Kakariko Carpenter House,                     OOT_HOUSE_CARPENTER
OOT_HOUSE_SKULLTULA,                      indoors,          Skulltula House,                            Kakariko,                                     OOT_KAKARIKO_FROM_SKULLTULA
OOT_KAKARIKO_FROM_SKULLTULA,              indoors,          Kakariko,                                   Skulltula House,                              OOT_HOUSE_SKULLTULA
OOT_HOUSE_IMPA,                           indoors,          Impa House Front,                           Kakariko,                                     OOT_KAKARIKO_FROM_IMPA
OOT_KAKARIKO_FROM_IMPA,                   indoors,          Kakariko,                                   Impa House Front,                             OOT_HOUSE_IMPA
OOT_HOUSE_IMPA_BACK,                      indoors,          Impa House Back,                            Kakariko Rooftop,                             OOT_KAKARIKO_FROM_IMPA_BACK
OOT_KAKARIKO_FROM_IMPA_BACK,              indoors,          Kakariko Rooftop,                           Impa House Back,                              OOT_HOUSE_IMPA_BACK
OOT_SHOP_GRANNY,                          indoors,          Kakariko Granny Shop,                       Kakariko Back,                                OOT_KAKARIKO_FROM_GRANNY
OOT_KAKARIKO_FROM_GRANNY,                 indoors,          Kakariko Back,                              Kakariko Granny Shop,                         OOT_SHOP_GRANNY
OOT_HOUSE_DAMPE,                          indoors,          Dampe House,                                Graveyard,                                    OOT_GRAVEYARD_FROM_DAMPE
OOT_GRAVEYARD_FROM_DAMPE,                 indoors,          Graveyard,                                  Dampe House,                                  OOT_HOUSE_DAMPE
OOT_SHOP_GORON,                           indoors,          Goron Shop,                                 Goron City,                                   OOT_GORON_CITY_FROM_SHOP
OOT_GORON_CITY_FROM_SHOP,                 indoors,          Goron City,                                 Goron Shop,                                   OOT_SHOP_GORON
OOT_SHOP_ZORA,                            indoors,          Zora Shop,                                  Zora Domain,                                  OOT_ZORA_DOMAIN_FROM_SHOP
OOT_ZORA_DOMAIN_FROM_SHOP,                indoors,          Zora Domain,                                Zora Shop,                                    OOT_SHOP_ZORA
OOT_HOUSE_LON_LON,                        indoors,          Lon Lon Ranch House,                        Lon Lon Ranch,                                OOT_LON_LON_RANCH_FROM_HOUSE
OOT_LON_LON_RANCH_FROM_HOUSE,             indoors,          Lon Lon Ranch,                              Lon Lon Ranch House,                          OOT_HOUSE_LON_LON
OOT_STABLES,                              indoors,          Lon Lon Ranch Stables,                      Lon Lon Ranch,                                OOT_LON_LON_RANCH_FROM_STABLES
OOT_LON_LON_RANCH_FROM_STABLES,           indoors,          Lon Lon Ranch,                              Lon Lon Ranch Stables,                        OOT_STABLES
OOT_SILO,                                 indoors,          Lon Lon Ranch Silo,                         Lon Lon Ranch,                                OOT_LON_LON_RANCH_FROM_SILO
OOT_LON_LON_RANCH_FROM_SILO,              indoors,          Lon Lon Ranch,                              Lon Lon Ranch Silo,                           OOT_SILO
OOT_HOUSE_LINK,                           indoors-special,  Link's House,                               Kokiri Forest,                                OOT_KOKIRI_FOREST_FROM_LINK
OOT_KOKIRI_FOREST_FROM_LINK,              indoors-special,  Kokiri Forest,                              Link's House,                                 OOT_HOUSE_LINK
OOT_TEMPLE_OF_TIME,                       indoors-special,  Temple of Time,                             Temple of Time Entryway,                      OOT_TEMPLE_OF_TIME_ENTRYWAY_FROM_TEMPLE
OOT_TEMPLE_OF_TIME_ENTRYWAY_FROM_TEMPLE,  indoors-special,  Temple of Time Entryway,                    Temple of Time,                               OOT_TEMPLE_OF_TIME
OOT_WINDMILL,                             indoors-special,  Windmill,                                   Kakariko,                                     OOT_KAKARIKO_FROM_WINDMILL
OOT_KAKARIKO_FROM_WINDMILL,               indoors-special,  Kakariko,                                   Windmill,                                     OOT_WINDMILL
OOT_SHOP_POTION_KAKARIKO,                 indoors-special,  Kakariko Potion Shop,                       Kakariko,                                     OOT_KAKARIKO_FROM_SHOP_POTION
OOT_KAKARIKO_FROM_SHOP_POTION,            indoors-special,  Kakariko,                                   Kakariko Potion Shop,                         OOT_SHOP_POTION_KAKARIKO
OOT_SHOP_POTION_KAKARIKO_BACK,            indoors-special,  Kakariko Potion Shop Back,                  Kakariko Back,                                OOT_KAKARIKO_FROM_SHOP_POTION_BACK
OOT_KAKARIKO_FROM_SHOP_POTION_BACK,       indoors-special,  Kakariko Back,                              Kakariko Potion Shop Back,                    OOT_SHOP_POTION_KAKARIKO_BACK
